category,title,creator,publication_year,description
book,Wake-up Cup,Bobbie Aufderhar,1946,Eaque cum architecto et.
album,The Captain's Select,Ms. Arlen Rogahn,1981,Quis harum soluta vel.
book,Express Town,Marlene Bogan,1945,Eaque ea et facere.
album,Spilt Cowboy,Miss Dino Kunze,1982,Soluta quia atque accusamus.
book,American Java,Desirae Reichel,2008,Laboriosam laudantium magnam illo.
book,Green Equinox,Carma Pagac,1935,Eius aut nulla nihil.
album,Jacked Breaker,Laure Keebler III,1934,Nisi quo itaque veritatis.
album,Seattle Coffee,Kasandra Okuneva,2012,Ipsa tempore dolorem doloremque.
book,Spilt Cowboy,Charlotte Wilkinson,1939,Explicabo cupiditate corrupti ad.
book,KrebStar Solstice,Mrs. Jerica Spencer,1962,Iusto nisi aut dolor.
book,Joe Forrester,Isaac Watsica,1996,Dolorum est sed facilis.
book,Hello Mug,Winford Nicolas II,1964,Ratione aliquam nemo rerum.
book,Evening Star,Rolande Wolf,1936,Non natus enim deserunt.
book,Dark Coffee,Miss Wilda O'Reilly,1940,Et enim voluptates autem.
album,Split Volcano,Dalila Barrows V,1977,Ducimus incidunt ea doloremque.
album,Evening Been,Miss Leisa Hayes,1936,Ut facere eum blanditiis.
album,Express Forrester,Ernestine Altenwerth,2004,Et cumque qui ut.
book,Kreb-Full-o Nuts,Winfred Schuppe,1929,In accusamus autem eum.
book,Café Volcano,Oscar Mraz II,1962,Ut ullam quae ipsam.
book,Cascara Java,Fernando McCullough,1966,Ad repudiandae aliquam numquam.
album,American Breaker,Dulce Hagenes PhD,1967,Eius molestiae quod tempore.
album,Goodbye Nuts,Dorla Simonis,1925,Et est rerum sit.
book,Captain's Look,Sang Miller,1997,Sunt consequuntur sunt voluptas.
album,Bluebery Cup,Delfina Lubowitz,1948,Quae deserunt soluta saepe.
album,Kreb-Full-o Choice,Ivy Zboncak,1939,Vel fugit dolorum excepturi.
